{
  "format": "tau.calibrator",
  "version": 1,
  "model": "laya-en-ft-tickets",
  "modelHash": "9079fee9291e35dc4d3ed8c817a8f1592d97e4413ccbae0539b7a0ee6d9c950a",
  "questionType": "score",
  "bucket": "3-5",
  "method": "isotonic",
  "isotonic": {
    "x": [
      0,
      0.003099999999999999,
      0.0031000000000000003,
      0.0031003100310031013,
      0.004199999999999998,
      0.004199999999999999,
      0.0072999999999999975,
      0.007299999999999998,
      0.0074000000000000055,
      0.007400000000000006,
      0.007699230076992302,
      0.007699230076992304,
      0.007700000000000001,
      0.007700000000000002,
      0.007700000000000003,
      0.007899999999999999,
      0.0079,
      0.0085,
      0.008500000000000002,
      0.4829,
      0.4829482948294829,
      0.49470000000000003,
      0.49489999999999995,
      0.4988501149885011,
      0.49899999999999994,
      0.5164516451645164,
      0.5166,
      0.5166516651665166,
      0.5292,
      0.5297,
      0.6087,
      0.6087391260873913,
      0.7647,
      0.7664766476647664,
      0.8897999999999999,
      0.8968,
      0.9509049095090492
    ],
    "y": [
      0,
      0,
      0.09309090909090907,
      0.09309090909090909,
      0.09309090909090909,
      0.0930909090909091,
      0.0930909090909091,
      0.1276595744680851,
      0.1276595744680851,
      0.14754098360655737,
      0.14754098360655737,
      0.21428571428571427,
      0.21428571428571427,
      0.2148274478330658,
      0.2169943820224719,
      0.2169943820224719,
      0.21699438202247193,
      0.21699438202247193,
      0.21699438202247195,
      0.21699438202247195,
      0.25675675675675674,
      0.25675675675675674,
      0.2727272727272727,
      0.2727272727272727,
      0.2736842105263158,
      0.2736842105263158,
      0.30030364372469637,
      0.3269230769230769,
      0.3269230769230769,
      0.3744292237442922,
      0.3744292237442922,
      0.4274193548387097,
      0.4274193548387097,
      0.5,
      0.5,
      0.5625,
      0.5625
    ]
  },
  "fitted": {
    "n": 1000,
    "dataset": "support-tickets",
    "datasetRevision": "8aae6044d2ff40ea9392603672ab694b33cca046c70c5a0c532392bb67efb9fb",
    "date": "2026-09-27",
    "eceBefore": 0.2504219,
    "eceAfter": 0.08202031742798908,
    "tool": "tau-workbench",
    "toolVersion": "0.1.0"
  }
}
