{
  "format": "tau.calibrator",
  "version": 1,
  "model": "laya-typed-decisions",
  "modelHash": "2b7a961ac37157d1cfa8105e3283106baf1ba2a5cc30fb3a673253f06aa1e1c5",
  "questionType": "score",
  "method": "isotonic",
  "isotonic": {
    "x": [
      0,
      0.009900990099009901,
      0.009999000099990005,
      0.012898710128987098,
      0.012899999999999997,
      0.013399999999999995,
      0.013399999999999999,
      0.014798520147985196,
      0.014798520147985198,
      0.014799999999999994,
      0.015299999999999998,
      0.015301530153015299,
      0.015301530153015304,
      0.01760000000000001,
      0.017701770177017694,
      0.18329999999999996,
      0.18330000000000002,
      0.1936,
      0.19381938193819384,
      0.19578042195780423,
      0.1958,
      0.21099999999999997,
      0.211,
      0.48949999999999994,
      0.4896489648964896,
      0.5205,
      0.5205520552055205,
      0.5325,
      0.5326467353264674,
      0.6944
    ],
    "y": [
      0,
      0,
      0.0047169811320754715,
      0.0047169811320754715,
      0.02631578947368421,
      0.02631578947368421,
      0.07575757575757576,
      0.07575757575757576,
      0.08549783549783549,
      0.09523809523809523,
      0.09523809523809523,
      0.13798049340218016,
      0.18072289156626506,
      0.18072289156626506,
      0.19724545007378258,
      0.19724545007378258,
      0.21951219512195122,
      0.21951219512195122,
      0.2222222222222222,
      0.2222222222222222,
      0.22413793103448276,
      0.22413793103448276,
      0.241028387787895,
      0.241028387787895,
      0.2621359223300971,
      0.2621359223300971,
      0.34210526315789475,
      0.34210526315789475,
      0.36633663366336633,
      0.36633663366336633
    ]
  },
  "fitted": {
    "n": 1000,
    "dataset": "support-tickets",
    "datasetRevision": "8aae6044d2ff40ea9392603672ab694b33cca046c70c5a0c532392bb67efb9fb",
    "date": "2026-09-27",
    "eceBefore": 0.24350509999999992,
    "eceAfter": 0.09446391913613568,
    "tool": "tau-workbench",
    "toolVersion": "0.1.0"
  }
}
