{
  "format": "tau.calibrator",
  "version": 1,
  "model": "von-1.2.0",
  "modelHash": "0777bb988636663b770775ae0b4eb961d6fbee176c9bea1d1da823723b1eb3f3",
  "questionType": "score",
  "method": "isotonic",
  "isotonic": {
    "x": [
      0,
      0.00466264336580926,
      0.004729757948488699,
      0.008671456705645,
      0.008798022697133794,
      0.03445730101360271,
      0.03445970337662239,
      0.04028967933053699,
      0.04029431461520419,
      0.05235018031113522,
      0.05239308939434863,
      0.056547362357378,
      0.056556975607913985,
      0.07608458087991776,
      0.07613221094504787,
      0.11631732512276317,
      0.11643294954377004,
      0.11689342166468203,
      0.1168937612477232,
      0.12209241137688014,
      0.12225222496500444,
      0.16362678212244744,
      0.1636604070663452,
      0.16424077932805695,
      0.16424868144288085,
      0.16683285371900156,
      0.16690707331081533,
      0.19871602202639066,
      0.19873566397862,
      0.2239606330403544,
      0.22397410547598257,
      0.2811336423076586,
      0.2814450159130612,
      0.2949132069187344,
      0.2951043734288076,
      0.3448427152523573,
      0.34503654930876754,
      0.3487145097591042,
      0.3487325776840532,
      0.3766471859201289,
      0.3771606301405885,
      0.4298568746048375,
      0.4299196222812008,
      0.43204136395331133,
      0.4321441384763335,
      0.4871004965037255,
      0.4874144828871972,
      0.5065042433124509,
      0.5069003720093532,
      0.5325505614455663,
      0.5327757060465481,
      0.5465237152170273,
      0.5468861358820248,
      0.8802730054100618,
      0.8858022499811647,
      0.9330736355247271
    ],
    "y": [
      0,
      0,
      0.029411764705882353,
      0.029411764705882353,
      0.04736842105263158,
      0.04736842105263158,
      0.05263157894736842,
      0.05263157894736842,
      0.06626506024096386,
      0.06626506024096386,
      0.06862745098039216,
      0.06862745098039216,
      0.081799591002045,
      0.081799591002045,
      0.0875,
      0.0875,
      0.09090909090909091,
      0.09090909090909091,
      0.09803921568627451,
      0.09803921568627451,
      0.11670020120724346,
      0.11670020120724346,
      0.125,
      0.125,
      0.17857142857142858,
      0.17857142857142858,
      0.21476510067114093,
      0.21476510067114093,
      0.23214285714285715,
      0.23214285714285715,
      0.25068870523415976,
      0.25068870523415976,
      0.2647058823529412,
      0.2647058823529412,
      0.28205128205128205,
      0.28205128205128205,
      0.3333333333333333,
      0.3333333333333333,
      0.33613445378151263,
      0.33613445378151263,
      0.3412698412698413,
      0.3412698412698413,
      0.4166666666666667,
      0.4166666666666667,
      0.45662100456621,
      0.45662100456621,
      0.5522388059701493,
      0.5522388059701493,
      0.5844155844155844,
      0.5844155844155844,
      0.6071428571428571,
      0.6071428571428571,
      0.628,
      0.628,
      0.6666666666666666,
      0.6666666666666666
    ]
  },
  "fitted": {
    "n": 1000,
    "dataset": "support-tickets",
    "datasetRevision": "46c1ec565c6c8dda61044250c224fc9a691688c44dd95a6ec87922bc7ca64943",
    "date": "2026-09-27",
    "eceBefore": 0.05197383752465247,
    "eceAfter": 0.035197736557312856,
    "tool": "tau-workbench",
    "toolVersion": "0.1.0"
  }
}
