{
  "format": "tau.calibrator",
  "version": 1,
  "model": "laya-typed-decisions",
  "modelHash": "2b7a961ac37157d1cfa8105e3283106baf1ba2a5cc30fb3a673253f06aa1e1c5",
  "questionType": "score",
  "bucket": "3-5",
  "method": "isotonic",
  "isotonic": {
    "x": [
      0,
      0.009955359238540932,
      0.009958918994765833,
      0.012941388051731846,
      0.012943934552789221,
      0.01336496829862831,
      0.013394022015406775,
      0.014756389330130104,
      0.014767103309755305,
      0.015239612403483127,
      0.015263420686030421,
      0.01536654073515685,
      0.015381453530152411,
      0.017618570181416097,
      0.017727459476928657,
      0.18298825952857578,
      0.18325209105614315,
      0.1884884034612637,
      0.18850067942545423,
      0.1958126763359079,
      0.19584896162890084,
      0.21005484618287418,
      0.21099866533654435,
      0.4895487970716717,
      0.4896073500963461,
      0.5205067502811072,
      0.5205174107868873,
      0.5324514960487435,
      0.5327000255816599,
      0.6944361095208881
    ],
    "y": [
      0,
      0,
      0.004651162790697674,
      0.004651162790697674,
      0.03125,
      0.03125,
      0.07352941176470588,
      0.07352941176470588,
      0.1111111111111111,
      0.1111111111111111,
      0.14285714285714285,
      0.14285714285714285,
      0.17721518987341772,
      0.17721518987341772,
      0.19734251968503938,
      0.19734251968503938,
      0.21052631578947367,
      0.21052631578947367,
      0.2222222222222222,
      0.2222222222222222,
      0.22608695652173913,
      0.22608695652173913,
      0.24089935760171305,
      0.24089935760171305,
      0.2621359223300971,
      0.2621359223300971,
      0.34210526315789475,
      0.34210526315789475,
      0.36633663366336633,
      0.36633663366336633
    ]
  },
  "fitted": {
    "n": 1000,
    "dataset": "support-tickets",
    "datasetRevision": "46c1ec565c6c8dda61044250c224fc9a691688c44dd95a6ec87922bc7ca64943",
    "date": "2026-09-27",
    "eceBefore": 0.24350592491030695,
    "eceAfter": 0.07290227564061823,
    "tool": "tau-workbench",
    "toolVersion": "0.1.0"
  }
}
