{
  "format": "tau.calibrator",
  "version": 1,
  "model": "von-1.2.0",
  "modelHash": "0777bb988636663b770775ae0b4eb961d6fbee176c9bea1d1da823723b1eb3f3",
  "questionType": "choice",
  "bucket": "11\u002B",
  "method": "isotonic",
  "isotonic": {
    "x": [
      0,
      9.998260302707299E-07,
      9.998260302707303E-07,
      9.999240057755619E-07,
      9.99924005775562E-07,
      9.999240057755623E-07,
      9.999240057755625E-07,
      9.999240057755627E-07,
      9.99924005775563E-07,
      9.99924005775564E-07,
      9.999240057755642E-07,
      9.999240057755653E-07,
      9.999240057755655E-07,
      9.999250056245755E-07,
      9.999250056245758E-07,
      9.99925005624576E-07,
      9.999250056245764E-07,
      9.999250056245766E-07,
      9.99925005624578E-07,
      9.999250056245783E-07,
      9.999250056245785E-07,
      9.999250056245787E-07,
      9.99925005624579E-07,
      9.999250056245794E-07,
      9.999250056245796E-07,
      9.999250056245798E-07,
      9.999250056245802E-07,
      9.999250056245804E-07,
      9.999270053286115E-07,
      9.999270053286117E-07,
      9.99927005328612E-07,
      9.999270053286132E-07,
      1.0000240005760175E-06,
      1.0000240005760205E-06,
      1.0000250006250093E-06,
      1.0000260006760194E-06,
      1.0000270007290163E-06,
      1.0000300009000275E-06,
      1.000031000961031E-06,
      1.0001250156269509E-06,
      1.0001290166431428E-06,
      9.998280295789136E-05,
      9.998280295789145E-05,
      9.999250056245817E-05,
      9.99925005624582E-05,
      9.999250056245828E-05,
      9.999250056245835E-05,
      9.999250056245839E-05,
      9.999250056245841E-05,
      9.999270053286128E-05,
      9.999270053286135E-05,
      0.00019998500112491593,
      0.0001999850011249163,
      0.008498529754352526,
      0.008499379545293197,
      0.011400285007125215,
      0.011499137564682654,
      0.07610197865144508,
      0.07669440130870425,
      0.0899932505062116,
      0.09079346287067325,
      0.14258944838081933,
      0.14328925330600223,
      0.20788440866935032,
      0.20838437117216202,
      0.3042082136217681,
      0.30677699172562095,
      0.35417343699222587,
      0.3543390536827667,
      0.7041485971524082,
      0.7041507094503395,
      0.7915406344524158,
      0.7920405969552305,
      0.8871334649901265,
      0.8879334049946253,
      0.9905277780833686,
      0.9909256805739515,
      0.9978251631127679,
      0.9979251556133292,
      0.9995250356223285,
      0.9995250356223294,
      0.9998250131240176,
      0.9998250131240178,
      0.9998250131240187,
      0.9998250131240198,
      0.9998250131240201,
      0.9999239981759617,
      0.9999240057755611,
      0.9999240057755613,
      0.9999240057755615,
      0.999924005775562,
      0.9999240057755622,
      0.9999240057755624,
      0.9999240057755628,
      0.9999240057755631,
      0.999924005775566,
      0.9999240057755662,
      0.9999240057755664,
      0.9999240057755671,
      0.9999240057755673
    ],
    "y": [
      0,
      0.00029207519425518316,
      0.0007452953232718467,
      0.0007452953232718467,
      0.0009990558723610304,
      0.0013297135575378375,
      0.0013297135575378375,
      0.0013297135575378405,
      0.0013297135575378418,
      0.0013297135575378418,
      0.001329713557537844,
      0.001329713557537844,
      0.0013297135575378455,
      0.0013297135575378455,
      0.0014140306083189932,
      0.0014230534661516599,
      0.0014230534661516599,
      0.0014230534661516733,
      0.0014230534661516733,
      0.001423053466151674,
      0.001423053466151674,
      0.0014230534661516746,
      0.001423053466151676,
      0.001423053466151676,
      0.001469976211891205,
      0.0015591936741285364,
      0.0015591936741285364,
      0.0015591936741285414,
      0.0015591936741285414,
      0.0017037269378033443,
      0.002179836512261571,
      0.0021798365122615826,
      0.0021798365122615826,
      0.002386762104813242,
      0.002450980392156861,
      0.002450980392156861,
      0.0024509803921568614,
      0.0024509803921568614,
      0.002450980392156862,
      0.005569315445476444,
      0.00877192982456142,
      0.00877192982456142,
      0.05263157894736842,
      0.05263157894736842,
      0.0708502024291498,
      0.07692307692307693,
      0.07692307692307693,
      0.08193979933110368,
      0.08695652173913043,
      0.08695652173913043,
      0.10526315789473684,
      0.10526315789473684,
      0.10843373493975904,
      0.10843373493975904,
      0.21428571428571427,
      0.21428571428571427,
      0.22602739726027396,
      0.22602739726027396,
      0.22727272727272727,
      0.22727272727272727,
      0.25,
      0.25,
      0.28125,
      0.28125,
      0.3333333333333333,
      0.3333333333333333,
      0.38461538461538464,
      0.38461538461538464,
      0.3977272727272727,
      0.3977272727272727,
      0.45714285714285713,
      0.45714285714285713,
      0.5,
      0.5,
      0.5695364238410596,
      0.5695364238410596,
      0.68,
      0.68,
      0.7391304347826086,
      0.7391304347826086,
      0.7391304347826088,
      0.7391304347826088,
      0.7541806020066889,
      0.7692307692307693,
      0.7692307692307693,
      0.8181818181818182,
      0.8181818181818182,
      0.8586956521739132,
      0.8586956521739132,
      0.8586956521739134,
      0.8586956521739134,
      0.8698692611736095,
      0.8996655518394651,
      0.8996655518394651,
      0.8996655518394652,
      0.8996655518394652,
      0.9391423793597706,
      0.96875,
      0.96875,
      0.9823369565217391
    ]
  },
  "fitted": {
    "n": 1000,
    "dataset": "banking77",
    "datasetRevision": "7ff6d7b0974afb66a781fccbeae9f58db38a37ebd2a0398792d5f2550ac6c79e",
    "date": "2026-09-27",
    "eceBefore": 0.20461950000000084,
    "eceAfter": 0.03830852918808669,
    "tool": "tau-workbench",
    "toolVersion": "0.1.0"
  }
}
