{
  "format": "tau.calibrator",
  "version": 1,
  "model": "laya-en-ft-banking77",
  "modelHash": "198e563957ce43348f944a10739bdf17929bc3d2175f22a72239b4601d421556",
  "questionType": "choice",
  "method": "isotonic",
  "isotonic": {
    "x": [
      0,
      0.0005998800239952004,
      0.0005998800239952005,
      0.0005998800239952006,
      0.0007997600719784066,
      0.0007997600719784067,
      0.0007997600719784068,
      0.0008002400720216068,
      0.0008002400720216069,
      0.000800240072021607,
      0.0008997300809757072,
      0.0008997300809757073,
      0.0008999100089991002,
      0.0008999100089991004,
      0.0010003000900270073,
      0.001000300090027008,
      0.0010003000900270082,
      0.0010996700989703099,
      0.00109967009897031,
      0.0011001100110010985,
      0.001100110011001099,
      0.0018014411529223286,
      0.0018014411529223323,
      0.0019007603041216474,
      0.0019007603041216478,
      0.0019007603041216483,
      0.001999800019997998,
      0.001999800019998,
      0.0021010505252626404,
      0.0021012607564538594,
      0.0021012607564538676,
      0.002199120351859251,
      0.002199120351859257,
      0.01119328402958225,
      0.01119552179128348,
      0.011498850114988515,
      0.011500000000000002,
      0.011702340468093621,
      0.011702340468093623,
      0.011703511053315992,
      0.016001600160016005,
      0.016004801440432124,
      0.01600480144043213,
      0.01910000000000001,
      0.01910382076415283,
      0.022506752025607674,
      0.022506752025607677,
      0.025302530253025302,
      0.025302530253025337,
      0.03190000000000001,
      0.03190319031903189,
      0.03410000000000001,
      0.03417949230461723,
      0.0351859256297481,
      0.03518592562974811,
      0.03940394039403941,
      0.03941182354706414,
      0.0464046404640464,
      0.04640464046404645,
      0.05692276910764305,
      0.057077169132347054,
      0.09050905090509052,
      0.09122736821046314,
      0.09240924092409243,
      0.09281856371274257,
      0.10325869652139145,
      0.1047895210478952,
      0.1470411835265894,
      0.14730000000000001,
      0.2560743925607439,
      0.2584,
      0.4815926370548229,
      0.49029611844737986,
      0.889044382247099,
      0.8958791758351673,
      0.9265926592659259,
      0.926607339266074,
      0.9420000000000016,
      0.9428771508603442,
      0.9558470164197058,
      0.9562218890554708,
      0.9599040095990397,
      0.959912026392083,
      0.9614653187869102,
      0.9615038496150387,
      0.9619114265720287,
      0.9619152339064384,
      0.9636854741896759,
      0.9638180909545225,
      0.9683778645051521,
      0.9683999999999989,
      0.9694908472541777,
      0.9694969496949661,
      0.9727754979481555,
      0.9727809466626639,
      0.9824684431977563
    ],
    "y": [
      0,
      0,
      8.122157244964262E-05,
      0.00024366471734892786,
      0.00024366471734892786,
      0.0008822624117048298,
      0.0014144271570014145,
      0.0014144271570014145,
      0.0015665447946411892,
      0.0016172506738544475,
      0.0016172506738544475,
      0.0016172506738544477,
      0.0016172506738544477,
      0.001617250673854448,
      0.001617250673854448,
      0.0027155607424235503,
      0.0030816640986132513,
      0.0030816640986132513,
      0.0030816640986132526,
      0.0030816640986132526,
      0.003081664098613253,
      0.003081664098613253,
      0.004830917874396135,
      0.004830917874396135,
      0.004890706461950543,
      0.0049504950495049506,
      0.0049504950495049506,
      0.004950495049504951,
      0.004950495049504951,
      0.005595956549842976,
      0.006241418050181001,
      0.006241418050181001,
      0.006241418050181002,
      0.006241418050181002,
      0.006329113924050633,
      0.006329113924050633,
      0.006329113924050634,
      0.006329113924050634,
      0.008032429006531575,
      0.009735744089012517,
      0.009735744089012517,
      0.009851260748825195,
      0.009966777408637873,
      0.009966777408637873,
      0.015544041450777202,
      0.015544041450777202,
      0.02158273381294964,
      0.02158273381294964,
      0.03070175438596491,
      0.03070175438596491,
      0.03225806451612903,
      0.03225806451612903,
      0.037037037037037035,
      0.037037037037037035,
      0.08333333333333333,
      0.08333333333333333,
      0.15625,
      0.15625,
      0.19047619047619047,
      0.19047619047619047,
      0.21518987341772153,
      0.21518987341772153,
      0.25,
      0.25,
      0.3333333333333333,
      0.3333333333333333,
      0.36,
      0.36,
      0.46153846153846156,
      0.46153846153846156,
      0.48484848484848486,
      0.48484848484848486,
      0.6428571428571429,
      0.6428571428571429,
      0.717948717948718,
      0.717948717948718,
      0.7804878048780488,
      0.7804878048780488,
      0.7926829268292683,
      0.7926829268292683,
      0.8,
      0.8,
      0.8695652173913043,
      0.8695652173913043,
      0.9285714285714286,
      0.9285714285714286,
      0.9333333333333333,
      0.9333333333333333,
      0.9389312977099237,
      0.9389312977099237,
      0.9782608695652174,
      0.9782608695652174,
      0.9934640522875817,
      0.9934640522875817,
      1,
      1
    ]
  },
  "fitted": {
    "n": 1000,
    "dataset": "banking77",
    "datasetRevision": "7ff6d7b0974afb66a781fccbeae9f58db38a37ebd2a0398792d5f2550ac6c79e",
    "date": "2026-09-27",
    "eceBefore": 0.06481969999999967,
    "eceAfter": 0.06523416197477791,
    "tool": "tau-workbench",
    "toolVersion": "0.1.0"
  }
}
