{
  "format": "tau.calibrator",
  "version": 1,
  "model": "von-1.2.0",
  "modelHash": "0777bb988636663b770775ae0b4eb961d6fbee176c9bea1d1da823723b1eb3f3",
  "questionType": "score",
  "bucket": "3-5",
  "method": "isotonic",
  "isotonic": {
    "x": [
      0,
      0.0045004500450045015,
      0.004699999999999999,
      0.008700870087008702,
      0.0088,
      0.034499999999999996,
      0.0345,
      0.0402959704029597,
      0.0403,
      0.05239999999999999,
      0.0524,
      0.056594340565943396,
      0.0565943405659434,
      0.0743925607439256,
      0.07439999999999998,
      0.0761,
      0.07610761076107608,
      0.11630000000000003,
      0.1164,
      0.1169,
      0.11690000000000002,
      0.11709999999999998,
      0.1221,
      0.12228777122287773,
      0.1636,
      0.16369999999999998,
      0.1638,
      0.164,
      0.1642,
      0.16441644164416439,
      0.16680000000000003,
      0.16690000000000002,
      0.1986801319868013,
      0.19869999999999996,
      0.20667933206679334,
      0.2068,
      0.22359999999999994,
      0.223977602239776,
      0.2240775922407759,
      0.28109999999999996,
      0.2814,
      0.2949,
      0.29507049295070487,
      0.3448,
      0.34503450345034503,
      0.3478,
      0.34796520347965204,
      0.37659999999999993,
      0.37716228377162286,
      0.4203579642035796,
      0.4205,
      0.4207,
      0.42990000000000006,
      0.4299429942994299,
      0.432,
      0.43210000000000004,
      0.4870999999999999,
      0.48739999999999994,
      0.5065506550655066,
      0.5069,
      0.5325467453254674,
      0.5328,
      0.5465,
      0.5469000000000002,
      0.8803880388038804,
      0.8858000000000003,
      0.933006699330067
    ],
    "y": [
      0,
      0,
      0.02857142857142857,
      0.02857142857142857,
      0.047244094488188976,
      0.047244094488188976,
      0.05303030303030303,
      0.05303030303030303,
      0.06626506024096386,
      0.06626506024096386,
      0.0673076923076923,
      0.0673076923076923,
      0.082039911308204,
      0.082039911308204,
      0.08333333333333333,
      0.08333333333333333,
      0.0875,
      0.0875,
      0.09090909090909091,
      0.09090909090909091,
      0.09566250742721331,
      0.09803921568627451,
      0.09803921568627451,
      0.11646586345381527,
      0.11646586345381527,
      0.12966150315547906,
      0.14285714285714285,
      0.14285714285714285,
      0.1607142857142857,
      0.17857142857142858,
      0.17857142857142858,
      0.21548821548821548,
      0.21548821548821548,
      0.2311111111111111,
      0.2311111111111111,
      0.23111111111111113,
      0.23111111111111113,
      0.24089990817263543,
      0.25068870523415976,
      0.25068870523415976,
      0.2647058823529412,
      0.2647058823529412,
      0.28205128205128205,
      0.28205128205128205,
      0.3333333333333333,
      0.3333333333333333,
      0.3360655737704918,
      0.3360655737704918,
      0.3412322274881517,
      0.3412322274881517,
      0.341347821061149,
      0.34146341463414637,
      0.34146341463414637,
      0.4166666666666667,
      0.4166666666666667,
      0.45662100456621,
      0.45662100456621,
      0.5522388059701493,
      0.5522388059701493,
      0.5844155844155844,
      0.5844155844155844,
      0.6071428571428571,
      0.6071428571428571,
      0.628,
      0.628,
      0.6666666666666666,
      0.6666666666666666
    ]
  },
  "fitted": {
    "n": 1000,
    "dataset": "support-tickets",
    "datasetRevision": "8aae6044d2ff40ea9392603672ab694b33cca046c70c5a0c532392bb67efb9fb",
    "date": "2026-09-27",
    "eceBefore": 0.0519748,
    "eceAfter": 0.03494269342019308,
    "tool": "tau-workbench",
    "toolVersion": "0.1.0"
  }
}
