{
  "format": "tau.calibrator",
  "version": 1,
  "model": "laya-en-ft-banking77",
  "modelHash": "198e563957ce43348f944a10739bdf17929bc3d2175f22a72239b4601d421556",
  "questionType": "choice",
  "bucket": "11\u002B",
  "method": "isotonic",
  "isotonic": {
    "x": [
      0,
      0.000600496347514496,
      0.0006005250091147434,
      0.0008290952286223381,
      0.0008291068291831089,
      0.001771144069687182,
      0.0017712173439266988,
      0.0019809846398372594,
      0.0019810715770437783,
      0.0021699064620792374,
      0.002170233411549196,
      0.011170348995886335,
      0.011171577623168876,
      0.011708681092020707,
      0.011710290753866264,
      0.01602812736179076,
      0.016034386055538797,
      0.019107773449113883,
      0.019111372568723094,
      0.02245583366273594,
      0.022463010586702886,
      0.025275232500050204,
      0.025275664540065343,
      0.03185929810647019,
      0.03189074769107381,
      0.03415264820654255,
      0.0341542814618078,
      0.035154982928646855,
      0.03517014714307605,
      0.03940539836407743,
      0.039432600787736916,
      0.046391953961445735,
      0.04641608316638544,
      0.05687012980807671,
      0.0571043912604796,
      0.09045601639385627,
      0.09124154634559112,
      0.0923835948511679,
      0.09282942148071971,
      0.1032900453399603,
      0.10481421950361973,
      0.14706634283552708,
      0.14729894491891923,
      0.2561172436711641,
      0.258446151879903,
      0.4814077871812044,
      0.4900511455166532,
      0.8894115025656975,
      0.8957417239205875,
      0.9264587729422953,
      0.9267317522699974,
      0.9420306958961725,
      0.9424802444795369,
      0.9549383419637892,
      0.9549471733107624,
      0.9567608621223616,
      0.956903695593318,
      0.9602537588008847,
      0.9602850298089584,
      0.9606111994547264,
      0.9606401812350133,
      0.9616395181410893,
      0.9617433572083203,
      0.9622456982545773,
      0.9623064656304859,
      0.9676603456346661,
      0.9676984993861274,
      0.9691534718814172,
      0.969183499142233,
      0.9718827606308188,
      0.9719150898359527,
      0.9807395803456948
    ],
    "y": [
      0,
      0,
      0.0002484472049689441,
      0.0002484472049689441,
      0.0028670899037476962,
      0.0028670899037476962,
      0.004273504273504274,
      0.004273504273504274,
      0.005249343832020997,
      0.005249343832020997,
      0.006163522012578616,
      0.006163522012578616,
      0.006622516556291391,
      0.006622516556291391,
      0.009641873278236915,
      0.009641873278236915,
      0.010067114093959731,
      0.010067114093959731,
      0.015625,
      0.015625,
      0.021739130434782608,
      0.021739130434782608,
      0.030303030303030304,
      0.030303030303030304,
      0.031746031746031744,
      0.031746031746031744,
      0.04,
      0.04,
      0.08139534883720931,
      0.08139534883720931,
      0.15789473684210525,
      0.15789473684210525,
      0.19047619047619047,
      0.19047619047619047,
      0.21518987341772153,
      0.21518987341772153,
      0.25,
      0.25,
      0.3333333333333333,
      0.3333333333333333,
      0.36,
      0.36,
      0.46153846153846156,
      0.46153846153846156,
      0.48484848484848486,
      0.48484848484848486,
      0.6428571428571429,
      0.6428571428571429,
      0.717948717948718,
      0.717948717948718,
      0.7804878048780488,
      0.7804878048780488,
      0.7866666666666666,
      0.7866666666666666,
      0.8,
      0.8,
      0.8205128205128205,
      0.8205128205128205,
      0.8571428571428571,
      0.8571428571428571,
      0.8947368421052632,
      0.8947368421052632,
      0.9,
      0.9,
      0.9315068493150684,
      0.9315068493150684,
      0.9824561403508771,
      0.9824561403508771,
      0.9911504424778761,
      0.9911504424778761,
      1,
      1
    ]
  },
  "fitted": {
    "n": 1000,
    "dataset": "banking77",
    "datasetRevision": "49c912d8b5eb821feba6396a5f0d167c10b8ed766bd997731940c3bf72dd264b",
    "date": "2026-09-28",
    "eceBefore": 0.06381917857006197,
    "eceAfter": 0.06645680921516578,
    "tool": "tau-workbench",
    "toolVersion": "0.1.0"
  }
}
