{
  "format": "tau.calibrator",
  "version": 1,
  "model": "laya-en",
  "modelHash": "866a05b244e47e96820660d18ee050c518c2de0f60c39e2e9a89dfeb056e1eec",
  "questionType": "choice",
  "method": "temperature",
  "temperature": 2.9512343878495293,
  "fitted": {
    "n": 1000,
    "dataset": "banking77",
    "datasetRevision": "49c912d8b5eb821feba6396a5f0d167c10b8ed766bd997731940c3bf72dd264b",
    "date": "2026-09-27",
    "eceBefore": 0.5000514454692602,
    "eceAfter": 0.07149340669494207,
    "tool": "tau-workbench",
    "toolVersion": "0.1.0"
  }
}
